{
  "id": "bi-han-killed-by-scorpion-original",
  "type": "event",
  "name": "Bi-Han is killed by Scorpion",
  "timelineId": "original",
  "participantIds": ["bi-han", "hanzo-hasashi"],
  "realmIds": ["earthrealm"],
  "causeEventIds": ["hanzo-returns-as-scorpion-original"],
  "consequenceEventIds": ["bi-han-becomes-noob-original"],
  "order": 110,
  "description": "Scorpion kills the original Sub-Zero, Bi-Han, in revenge.",
  "tags": ["death", "revenge"]
}
